Maanyan;Indonesia
daya aku puang sagar nanan hanyu;sebab aku tidak akan meninggalkan engkau
malengkan magun nampalus inun sa najanyiku ma hanyu;melainkan tetap melakukan apa yang kujanjikan kepadamu
hi yakub kaelan balalu kaeau;yakub bangun dari tidurnya lalu berkata
kapinuuni tuhan naan hang unengan yina;sesungguhnya tuhan ada di tempat ini
kude aku puang karasa;dan aku tidak mengetahuinya
hanye gaer nelang kaeau;ia takut dan berkata
hiah tamamni unengan yina yina puang lain lewu alatalla;alangkah dahsyatnya tempat ini ini tidak lain dari rumah allah
yina wanawang surga;inilah pintu gerbang surga
kaiat kiunini hi yakub ngalap watu sa napakaini umak unnan balalu naampinri jari tungun watu;keesokan harinya pagipagi yakub mengambil batu yang dipakainya sebagai alas kepala dan mendirikannya sebagai tugu
palus nalui ilau ma ammauni;lalu menuang minyak ke atasnya
hanye ngampingaran unengan yiru betel;ia menamai tempat itu betel
kude sadi ngaran tumpuk hante yiru lus;sedangkan dahulu nama kota itu lus
balalu hi yakub bahajat;lalu yakub bernazar
amun alatalla nyinrah nelang nyalinnung aku hang lalan sa nakiaku yina;jika allah menyertai dan melindungi aku di jalan yang kutempuh ini
ngammi rute ma aku umak nakuta nelang pamma umak napakai;memberikan kepadaku roti untuk dimakan dan pakaian untuk dipakai
hampe aku mulek jari janang ma lewu ammahku;sehingga aku kembali dengan selamat ke rumah ayahku
hanyu tuhan jari alatallaku;maka tuhan akan menjadi allahku
watu sa naampinriku jari tungun watu yina sagar jari lewu alatalla;batu yang kudirikan sebagai tugu ini akan menjadi rumah allah
teka katantuluh sa naamminu ma aku  sapersapuluh saratang naparapahku ma hanyu;dari segala sesuatu yang engkau berikan kepadaku akan selalu kupersembahkan sepersepuluh kepadamu
